{
  "schema": "question/1",
  "id": "2026-09-25-night-01",
  "shift": "2026-09-25-night",
  "card": "logo-marks",
  "blocking": false,
  "topic": "Brand",
  "question": "Which small-size mark do we keep?",
  "why": "All three stay readable at 32 px; they differ in character.",
  "kind": "one",
  "options": [
    { "id": "ring", "label": "Ring", "detail": "Beam inside a ring", "image": "assets/mark-a.svg" },
    { "id": "beam", "label": "Beam", "detail": "One bold diagonal beam", "image": "assets/mark-b.svg" },
    { "id": "tower", "label": "Tower", "detail": "The lighthouse itself", "image": "assets/mark-c.svg" }
  ],
  "recommended": ["ring"],
  "because": "The ring survives as a favicon; the tower turns to mush below 48 px.",
  "answer": null,
  "resolved": null
}
