{
  "schema": "question/1",
  "id": "2026-09-25-night-06",
  "shift": "2026-09-25-night",
  "card": "email-digest",
  "topic": "Email",
  "question": "Subject line for the weekly digest?",
  "kind": "text",
  "recommended": ["Your week at Lighthouse"],
  "because": "Short, and it names the product.",
  "answer": null,
  "resolved": null
}
