{
  "schema": "question/1",
  "id": "2026-09-25-night-03",
  "shift": "2026-09-25-night",
  "topic": "Search",
  "question": "Delete the old search endpoint now?",
  "why": "Nothing has called it for 30 days.",
  "kind": "confirm",
  "recommended": ["yes"],
  "because": "Less code to keep working; the logs show no callers.",
  "answer": null,
  "resolved": null
}
