{
  "schema": "question/1",
  "id": "2026-09-25-night-05",
  "shift": "2026-09-25-night",
  "topic": "Tonight",
  "question": "Tonight's order?",
  "why": "search-filters and search-speed collide, so they run one after the other.",
  "kind": "rank",
  "options": [
    { "id": "search-speed", "label": "search-speed", "detail": "S · build" },
    { "id": "search-filters", "label": "search-filters", "detail": "M · build" },
    { "id": "hero-options", "label": "hero-options", "detail": "L · explore" },
    { "id": "email-digest", "label": "email-digest", "detail": "? · build" }
  ],
  "recommended": ["search-speed", "hero-options", "search-filters", "email-digest"],
  "because": "The small card first, the long explore card in parallel with it.",
  "answer": null,
  "resolved": null
}
